{
  "id": "custom.combat_fx_crisp_hitstop",
  "version": 1,
  "title": "Combat FX \u2014 Crisp hit-stop",
  "description": "Apply graphical combat profile \"crisp_hitstop\" plus tuned attack feel.",
  "category": "combat",
  "engine_status": "ruleset_patch",
  "patches": {
    "verbs.attack.harm_entropy": 0.55,
    "tightness": 0.9,
    "presentation.combat": {
      "profile_id": "crisp_hitstop",
      "title": "Crisp hit-stop",
      "tags": [
        "melee",
        "readable",
        "arcade"
      ],
      "hit_stop_ms": 52,
      "screen_shake": 0.22,
      "zoom_punch": 0.04,
      "chromatic_aberration": 0.12,
      "flash_color": "#ffe8d0",
      "flash_ms": 35,
      "damage_number_style": "arcade_pop",
      "trail_style": "none",
      "impact_particles": [
        {
          "id": "spark_fan",
          "count": 18,
          "spread_deg": 42,
          "speed": 4.2,
          "lifetime_ms": 180,
          "color": "#ffcc66",
          "blend": "add"
        }
      ],
      "camera": {
        "shake_decay": 0.85,
        "follow_lag": 0.08,
        "fov_kick_deg": 1.2
      },
      "audio": {
        "impact": "hit_metal_short",
        "whoosh": "swing_light",
        "sub_bass": "thump_tight"
      },
      "haptics": {
        "light_ms": 12,
        "heavy_ms": 28,
        "pattern": "double"
      },
      "satisfiers": [
        "hit_confirm_ping",
        "enemy_hit_flash",
        "knockback_pulse"
      ],
      "effects": [
        {
          "id": "frame_hold",
          "trigger": "on_hit",
          "duration_ms": 52,
          "intensity": 0.9,
          "visual": "time_scale_0",
          "notes": "Local hit-stop; scale time for attacker + victim"
        }
      ]
    }
  },
  "combat_presentation": {
    "profile_id": "crisp_hitstop",
    "title": "Crisp hit-stop",
    "tags": [
      "melee",
      "readable",
      "arcade"
    ],
    "hit_stop_ms": 52,
    "screen_shake": 0.22,
    "zoom_punch": 0.04,
    "chromatic_aberration": 0.12,
    "flash_color": "#ffe8d0",
    "flash_ms": 35,
    "damage_number_style": "arcade_pop",
    "trail_style": "none",
    "impact_particles": [
      {
        "id": "spark_fan",
        "count": 18,
        "spread_deg": 42,
        "speed": 4.2,
        "lifetime_ms": 180,
        "color": "#ffcc66",
        "blend": "add"
      }
    ],
    "camera": {
      "shake_decay": 0.85,
      "follow_lag": 0.08,
      "fov_kick_deg": 1.2
    },
    "audio": {
      "impact": "hit_metal_short",
      "whoosh": "swing_light",
      "sub_bass": "thump_tight"
    },
    "haptics": {
      "light_ms": 12,
      "heavy_ms": 28,
      "pattern": "double"
    },
    "satisfiers": [
      "hit_confirm_ping",
      "enemy_hit_flash",
      "knockback_pulse"
    ],
    "effects": [
      {
        "id": "frame_hold",
        "trigger": "on_hit",
        "duration_ms": 52,
        "intensity": 0.9,
        "visual": "time_scale_0",
        "notes": "Local hit-stop; scale time for attacker + victim"
      }
    ]
  },
  "design_notes": [
    "Profile: crisp_hitstop. Tags: melee, readable, arcade.",
    "Merge into draft in Mechanics Forge \u2192 Extensions \u2192 Apply patches to ruleset draft."
  ],
  "compatible_rulesets": [
    "pmr.v1"
  ]
}
