{
  "id": "custom.combat_fx_multi_hit_flurry",
  "version": 1,
  "title": "Combat FX \u2014 Multi-hit flurry",
  "description": "Apply graphical combat profile \"multi_hit_flurry\" plus tuned attack feel.",
  "category": "combat",
  "engine_status": "ruleset_patch",
  "patches": {
    "verbs.attack.damage": 22,
    "verbs.attack.stamina_cost": 8,
    "presentation.combat": {
      "profile_id": "multi_hit_flurry",
      "title": "Multi-hit flurry",
      "tags": [
        "fast",
        "combo"
      ],
      "hit_stop_ms": 14,
      "screen_shake": 0.12,
      "zoom_punch": 0.02,
      "chromatic_aberration": 0.08,
      "flash_color": "#fff0cc",
      "flash_ms": 12,
      "damage_number_style": "combo_stack",
      "trail_style": "slash_ribbon",
      "impact_particles": [
        {
          "id": "micro_spark",
          "count": 6,
          "spread_deg": 25,
          "speed": 5.5,
          "lifetime_ms": 90,
          "color": "#ffcc88",
          "blend": "add"
        }
      ],
      "camera": {
        "shake_decay": 0.93,
        "follow_lag": 0.04,
        "fov_kick_deg": 0.6
      },
      "audio": {
        "impact": "hit_flurry",
        "whoosh": "swing_rapid"
      },
      "haptics": {
        "light_ms": 4,
        "heavy_ms": 10,
        "pattern": "single"
      },
      "satisfiers": [
        "combo_counter",
        "hit_confirm_ping"
      ],
      "effects": [
        {
          "id": "hit_stop_micro_stack",
          "trigger": "on_hit",
          "duration_ms": 14,
          "intensity": 0.5,
          "visual": "stacking_micro_freeze"
        }
      ]
    }
  },
  "combat_presentation": {
    "profile_id": "multi_hit_flurry",
    "title": "Multi-hit flurry",
    "tags": [
      "fast",
      "combo"
    ],
    "hit_stop_ms": 14,
    "screen_shake": 0.12,
    "zoom_punch": 0.02,
    "chromatic_aberration": 0.08,
    "flash_color": "#fff0cc",
    "flash_ms": 12,
    "damage_number_style": "combo_stack",
    "trail_style": "slash_ribbon",
    "impact_particles": [
      {
        "id": "micro_spark",
        "count": 6,
        "spread_deg": 25,
        "speed": 5.5,
        "lifetime_ms": 90,
        "color": "#ffcc88",
        "blend": "add"
      }
    ],
    "camera": {
      "shake_decay": 0.93,
      "follow_lag": 0.04,
      "fov_kick_deg": 0.6
    },
    "audio": {
      "impact": "hit_flurry",
      "whoosh": "swing_rapid"
    },
    "haptics": {
      "light_ms": 4,
      "heavy_ms": 10,
      "pattern": "single"
    },
    "satisfiers": [
      "combo_counter",
      "hit_confirm_ping"
    ],
    "effects": [
      {
        "id": "hit_stop_micro_stack",
        "trigger": "on_hit",
        "duration_ms": 14,
        "intensity": 0.5,
        "visual": "stacking_micro_freeze"
      }
    ]
  },
  "design_notes": [
    "Profile: multi_hit_flurry. Tags: fast, combo.",
    "Merge into draft in Mechanics Forge \u2192 Extensions \u2192 Apply patches to ruleset draft."
  ],
  "compatible_rulesets": [
    "pmr.v1"
  ]
}
